{
  "$schema": "./token-schema.json",
  "color": {
    "primary": {
      "base": "#3b82f6",
      "hover": "#2563eb",
      "active": "#1d4ed8",
      "foreground": "#ffffff"
    },
    "secondary": {
      "base": "#64748b",
      "hover": "#475569",
      "active": "#334155",
      "foreground": "#ffffff"
    },
    "neutral": {
      "50": "#f8fafc",
      "100": "#f1f5f9",
      "200": "#e2e8f0",
      "300": "#cbd5e1",
      "400": "#94a3b8",
      "500": "#64748b",
      "600": "#475569",
      "700": "#334155",
      "800": "#1e293b",
      "900": "#0f172a",
      "950": "#020617"
    },
    "success": {
      "base": "#22c55e",
      "hover": "#16a34a",
      "active": "#15803d",
      "foreground": "#ffffff"
    },
    "warning": {
      "base": "#f59e0b",
      "hover": "#d97706",
      "active": "#b45309",
      "foreground": "#000000"
    },
    "error": {
      "base": "#ef4444",
      "hover": "#dc2626",
      "active": "#b91c1c",
      "foreground": "#ffffff"
    },
    "background": {
      "base": "#ffffff",
      "muted": "#f8fafc",
      "subtle": "#f1f5f9"
    },
    "foreground": {
      "base": "#0f172a",
      "muted": "#64748b",
      "subtle": "#94a3b8"
    },
    "border": {
      "base": "#e2e8f0",
      "muted": "#f1f5f9",
      "strong": "#cbd5e1"
    }
  },
  "spacing": {
    "0": "0",
    "px": "1px",
    "0.5": "0.125rem",
    "1": "0.25rem",
    "1.5": "0.375rem",
    "2": "0.5rem",
    "2.5": "0.625rem",
    "3": "0.75rem",
    "3.5": "0.875rem",
    "4": "1rem",
    "5": "1.25rem",
    "6": "1.5rem",
    "7": "1.75rem",
    "8": "2rem",
    "9": "2.25rem",
    "10": "2.5rem",
    "12": "3rem",
    "14": "3.5rem",
    "16": "4rem",
    "20": "5rem",
    "24": "6rem"
  },
  "typography": {
    "fontFamily": {
      "sans": "Inter, ui-sans-serif, system-ui, -apple-system, sans-serif",
      "mono": "JetBrains Mono, ui-monospace, monospace"
    },
    "fontSize": {
      "xs": "0.75rem",
      "sm": "0.875rem",
      "base": "1rem",
      "lg": "1.125rem",
      "xl": "1.25rem",
      "2xl": "1.5rem",
      "3xl": "1.875rem",
      "4xl": "2.25rem"
    },
    "fontWeight": {
      "normal": "400",
      "medium": "500",
      "semibold": "600",
      "bold": "700"
    },
    "lineHeight": {
      "none": "1",
      "tight": "1.25",
      "snug": "1.375",
      "normal": "1.5",
      "relaxed": "1.625",
      "loose": "2"
    },
    "letterSpacing": {
      "tighter": "-0.05em",
      "tight": "-0.025em",
      "normal": "0em",
      "wide": "0.025em",
      "wider": "0.05em"
    }
  },
  "borderRadius": {
    "none": "0",
    "sm": "0.25rem",
    "md": "0.375rem",
    "lg": "0.5rem",
    "xl": "0.75rem",
    "2xl": "1rem",
    "full": "9999px"
  },
  "shadow": {
    "none": "none",
    "sm": "0 1px 2px 0 rgb(0 0 0 / 0.05)",
    "md": "0 4px 6px -1px rgb(0 0 0 / 0.1), 0 2px 4px -2px rgb(0 0 0 / 0.1)",
    "lg": "0 10px 15px -3px rgb(0 0 0 / 0.1), 0 4px 6px -4px rgb(0 0 0 / 0.1)",
    "xl": "0 20px 25px -5px rgb(0 0 0 / 0.1), 0 8px 10px -6px rgb(0 0 0 / 0.1)"
  },
  "transition": {
    "none": "none",
    "fast": "150ms cubic-bezier(0.4, 0, 0.2, 1)",
    "normal": "200ms cubic-bezier(0.4, 0, 0.2, 1)",
    "slow": "300ms cubic-bezier(0.4, 0, 0.2, 1)"
  },
  "zIndex": {
    "0": "0",
    "10": "10",
    "20": "20",
    "30": "30",
    "40": "40",
    "50": "50",
    "dropdown": "1000",
    "modal": "1100",
    "tooltip": "1200"
  }
}
